episode_name,rating,air_date,description,episode_number
Time Zones,7.9,            13 Apr. 2014    ,"Don is on the outside looking in on the forced indefinite paid leave from his job. While Ted heads back to New York for a few days, Don takes the opportunity to head to Los Angeles in part to meet with a California transformed Pete while he reunites with Megan, who is living full time there while pursuing what looks to be a promising acting career. Back in New York, Peggy avoids Ted at all cost while she learns to deal with the new ""Don"", Lou Avery, most specifically on the Accutron account for which she is getting consulting help from Freddie Rumsen. On top of that, ...    ","S7, Ep1"
Field Trip,8.5,            27 Apr. 2014    ,"After a fight with Megan during a surprise trip to California, Don decides it's time to get back to work. Meanwhile, Betty joins Bobby on a field trip to a farm.    ","S7, Ep3"
The Runaways,8.5,            11 May 2014    ,"While Lou becomes the object of ridicule for the copy writers, Don tries to get away to California after a call from his pregnant niece. Meanwhile, the new office computer drives Ginsberg to the brink of insanity.    ","S7, Ep5"
Waterloo,9.5,            25 May 2014    ,"Don and Peggy prepare to pitch to Burger Chef, one day after the Apollo Moon Landing. Meanwhile, a power struggle in the firm between Sterling and Cutler leaves Don's future hanging in the balance.    ","S7, Ep7"
New Business,7.8,            12 Apr. 2015    ,"While Megan comes to New York with her mother and sister to collect her belongings, Don has a romance with the waitress. Meanwhile, Peggy and Stan work with a famous photographer on a commercial shoot.    ","S7, Ep9"
Time & Life,8.9,            26 Apr. 2015    ,"The partners discover that the firm is losing its independence and there's nothing they can do about it. Peggy is not sure if she wants to come along. Meanwhile, Pete and Trudy have trouble getting their daughter into private school.    ","S7, Ep11"
The Milk and Honey Route,9.1,            10 May 2015    ,Don is stuck in Oklahoma after his car breaks down. Betty discovers that she is not in good health. Pete gets an unexpected job offer that could enable him to get his life with Trudy and his daughter back.    ,"S7, Ep13"
A Day's Work,8.3,            20 Apr. 2014    ,"Sally discovers that Don is not working, Pete lands a big account but is undercut by management, and Joan is forced to move some secretaries around after Lou and Peggy have some problems.    ","S7, Ep2"
The Monolith,8.5,            4 May 2014    ,"Don returns to work, but quickly falls off the wagon after learning that he's been assigned to Peggy. Meanwhile, Roger and his ex-wife go to a commune to rescue their daughter, who has abandoned her child.    ","S7, Ep4"
The Strategy,8.9,            18 May 2014    ,"Peggy has second thoughts about her Burger Chef campaign when Don is asked to pitch her commercial, Pete visits his wife and daughter on his trip back to New York, and Bob Benson gets some surprising news from G.M. about the account.    ","S7, Ep6"
Severance,8.1,            5 Apr. 2015    ,"Don is oddly drawn to a diner waitress as he learns about the loss of an old acquaintance, Peggy and Joan are disrespected by a chauvinistic client, and Cosgrove is in for big changes after his biggest business connection retires.    ","S7, Ep8"
The Forecast,8.3,            19 Apr. 2015    ,"Don decides to sell his apartment, Joan stumbles into a relationship while on a trip to Los Angeles, Glen tells Betty and Sally that he is going to Vietnam, and a copywriter gets in trouble for his rude behavior to a client.    ","S7, Ep10"
Lost Horizon,9.0,            3 May 2015    ,Don goes AWOL from McCann Erickson in the middle of a meeting. Joan quickly gets fed up with the sexism at the new firm. Roger and Peggy put off reporting to their new jobs as long as possible.    ,"S7, Ep12"
Person to Person,9.3,            17 May 2015    ,"Don's journey ends in California with Anna's niece, Stephanie, where he contemplates his future. Roger decides to marry Megan's mother, Marie. Joan has a business proposition for Peggy, who is coming to terms with her feelings for Stan.    ","S7, Ep14"
Smoke Gets in Your Eyes,8.1,            19 Jul. 2007    ,"New York City, 1960s. In the ego-driven Golden Age of advertising, everyone is selling something and nothing is what it seems.    ","S1, Ep1"
Marriage of Figaro,7.6,            2 Aug. 2007    ,Pete returns home from his honeymoon excited about his new marriage but conflicted about his past encounter with Peggy.    ,"S1, Ep3"
5G,8.1,            16 Aug. 2007    ,"Don Draper is shaken when his past life comes back to haunt him. After his picture appears in a local newspaper, Adam Whitman, a man who claims to be his younger brother, approaches him. Don, or Dick as his brother knows him, initially denies everything but in the end admits to having taken on a new name. He refuses however to have anything to do with him and tries to buy his silence. When one of the ad men gets a short story published, Pete Campbell is frustrated that his own stories have yet to see the light of day. When his wife approaches an old beau to see if he ...    ","S1, Ep5"
Red in the Face,8.0,            30 Aug. 2007    ,"When Don invites Roger home for dinner, too much alcohol fuels repercussions between Don and Betty and between Don and Roger. Joan puts Roger off for the weekend, spending time with her roommate Carol instead. Pete exchanges a wedding gift for a rifle, and then shares a hunting fantasy with Peggy. Bertram Cooper arranges for the Nixon campaign to meet with him, Roger, Don, and Pete.    ","S1, Ep7"
Shoot,8.2,            13 Sep. 2007    ,"Don is courted by Jim Hobart, head of a larger ad firm who offers him more money and more creative resources to join them. Betty Draper rekindles her interest in modeling after Hobart suggests she should try it. She doesn't realize it's all part of the strategy to get Don on board. Peggy Olsen is fretting over her weight gain but doesn't appreciate Joan's advice about getting ahead in the office. The ad team tries to counter the advertising coming out of the Kennedy campaign. Pete Campbell comes up with an idea to keep Kennedy's image off TV in key States.    ","S1, Ep9"
Indian Summer,8.1,            4 Oct. 2007    ,"Peggy is given the opportunity to write copy for a new weight loss device that everyone knows is useless. She finds an interesting use for it, however. Afraid of losing the Lucky Strike cigarette account, Bert Cooper gets Roger Sterling to come in for a one-hour meeting but he has another attack. Don Draper becomes a partner and takes over for his friend Roger, but some of the ad men are sharpening their resumes nonetheless. Pete Campbell wants a promotion but Draper doesn't seem too interested. Pete sneaks into Don's office and takes home a parcel sent by Adam ...    ","S1, Ep11"
The Wheel,9.0,            18 Oct. 2007    ,"Don and Betty Draper have an argument when it becomes apparent that he doesn't want to spend Thanksgiving with her family and she plans on going only with the children. He also learns some information about his brother Adam. Pete Campbell confirms that he has landed an account from his father-in-law for a new skin care product called Clearasil. He objects however when Don gives the account to Peggy Olson, whom he has just promoted to junior copywriter. Peggy proves her mettle in auditions for the weight loss device but later is feeling unwell and goes to the hospital ...    ","S1, Ep13"
Ladies Room,7.5,            26 Jul. 2007    ,"Don continues to conceal his complicated personal life, even in the face of Roger's invitation to open up.    ","S1, Ep2"
New Amsterdam,7.9,            9 Aug. 2007    ,"Pete Campbell oversteps the mark when he pitches an idea for ad campaign to the head of Bethlehem Steel without telling Don Draper. Draper wants him fired but learns a lesson in corporate politics. Pete's wife wants to buy a Manhattan apartment but he has to approach his cold and distant parents for a loan. Pete's in-laws, however, are more forthcoming.    ","S1, Ep4"
Babylon,7.9,            23 Aug. 2007    ,The Agency is looking to land an advertising contract to promote tourism to Israel. Don and his team try to come up with a theme but know so little about the country that they're stumped. So Don calls Rachel Menken to see if she has any ideas. Roger Sterling is getting tired of sneaking around with Joan Holloway and suggests she should get her own apartment but she knows better. Peggy comes up with an advertising concept during a testing session for a new line of lipsticks and she's subsequently asked to write copy.    ,"S1, Ep6"
The Hobo Code,8.3,            6 Sep. 2007    ,"Pete Campbell and Peggy Olson start an office romance. Peggy's copy for the lipstick account goes over well and the men in the firm congratulate her. A new telephone receptionist, Lois Saddler, takes a liking to Salvatore Romano but his own interests seem to lie elsewhere. Don Draper gets an unexpected bonus from Bert Cooper and wants to take Midge on a surprise trip to Paris. She seems too involved with her beatnik friends however. Don reflects on his unhappy childhood and in flashbacks he reveals some life lessons he learned early on when a hobo spent the day ...    ","S1, Ep8"
Long Weekend,8.2,            27 Sep. 2007    ,"It's Labor Day weekend and most of the men are sending their wives away for a few days. Don Draper's wife Betty is dreading the thought, as her father and his new girlfriend, whom she detests, will be staying with them. With the election approaching, the team at Sterling Cooper is gloomy since the Nixon campaign has not been following their advice. Roger Sterling was hoping to spend Friday night with Joan Holloway but having just seen the movie The Apartment (1960), she is feeling a bit used. She plans a night on the town with her old college friend who has some surprising information ...    ","S1, Ep10"
Nixon vs. Kennedy,9.0,            11 Oct. 2007    ,"Election night arrives and the staff of Sterling Cooper has a party while watching the returns. The election is close and it's obviously going to be a long night. Now a senior partner in the firm, Don Draper must hire a new head of account services, a post that Pete Campbell yearns for. Aware of Draper's secret past, he tries to strong-arm him into giving him the job. With his secret out, Don panics and he asks Rachel Menken to run away with him. Regaining his composure, Don calls Pete's bluff leading to a confrontation with Bert Cooper.    ","S1, Ep12"
For Those Who Think Young,7.7,            27 Jul. 2008    ,"On Valentine's Day, the staff of the Sterling Cooper Advertising Agency is hustling and checking out the newest office equipment. Don and Duck clash over an account, and Betty hears from an old friend.    ","S2, Ep1"
The Benefactor,7.8,            10 Aug. 2008    ,Trouble rises on the set of a commercial while Don plays hooky from the office.    ,"S2, Ep3"
The New Girl,8.3,            24 Aug. 2008    ,"Joan finds Don the perfect secretary, and Don finds himself in the middle of issues between TV comedian Jimmy and his wife, Bobbie.    ","S2, Ep5"
The Gold Violin,8.4,            7 Sep. 2008    ,"To show that he has ""arrived,"" Don buys a new car. Pete, Harry and Ken come up with a plan to attract new business, and Don's secretary makes a serious error, which could mean trouble for Joan. Cooper gets a new piece of office art that attracts the interest of the Sterling Cooper staff.    ","S2, Ep7"
Six Month Leave,8.5,            28 Sep. 2008    ,"Don checks in to a hotel after his separation from Betty. Back at the office, he is forced to get rid of Freddy against his will because of his drinking problem.    ","S2, Ep9"
The Jet Set,8.3,            12 Oct. 2008    ,"Don blows off the convention in Los Angeles when he meets a beautiful, exotic woman. Back at Sterling Cooper, a member of the creative staff comes out of the closet, and Duck falls off the wagon and initiates his power play.    ","S2, Ep11"
Meditations in an Emergency,8.9,            26 Oct. 2008    ,"Under the backdrop of the Cuban Missile Crisis, Don returns to New York just as Betty finds out that she is pregnant. Meanwhile, everybody at Sterling Cooper contemplates their futures as news of the merger slowly leaks out.    ","S2, Ep13"
Flight 1,7.8,            3 Aug. 2008    ,"A plane crash causes the firm to go after the account for the airline involved and drop the smaller airline they have an account with. Peggy pays a visit to her mother and sister, who are now guardians of a child.    ","S2, Ep2"
Three Sundays,8.1,            17 Aug. 2008    ,Freddy and Ken take a client out to lunch who stirs Roger Sterling's heart.    ,"S2, Ep4"
Maidenform,7.9,            31 Aug. 2008    ,"Don and Duck try to bury the hatchet, and Peggy attempts to join in on the execs' after-hours meetings. Also, Duck receives a family visit at the office.    ","S2, Ep6"
A Night to Remember,8.3,            14 Sep. 2008    ,"Betty becomes suspicious that Don is having an affair after her conversation with Jimmy Barrett, Joan helps out in the television department, and Peggy helps the church with a dance flyer.    ","S2, Ep8"
The Inheritance,7.9,            5 Oct. 2008    ,Don and Betty try to keep up appearances as they go to Betty's parents after her dad has a stroke. Peter has a long-dreaded meeting with his mother before he and Kinsey leave for a convention in Los Angeles.    ,"S2, Ep10"
The Mountain King,8.5,            19 Oct. 2008    ,"Don drops off the Sterling Cooper radar and visits the wife of the man whose identity he stole. Back at the office, Bert and Roger consider the merger offer, Peggy makes a play for a real office, and Peter loses his father-in-law's account.    ","S2, Ep12"
Out of Town,8.2,            16 Aug. 2009    ,"Don accidentally learns a secret about Salvatore during a business trip to Baltimore. Back at the office, the firings continue, but the new management appoints Peter and Ken as new co-heads of accounts.    ","S3, Ep1"
My Old Kentucky Home,8.1,            30 Aug. 2009    ,"Roger Sterling throws an expensive party with his new wife, Joan throws a dinner party, Peggy and Paul get stoned while working on an ad campaign, and Don's daughter Sally steals money from her grandpa.    ","S3, Ep3"
The Fog,8.0,            13 Sep. 2009    ,"Betty has hallucinations of her deceased father as she delivers her baby, Peter considers trying to sell the untapped ""Negro market"" to a reluctant client, and Peggy begins to question her future at Sterling Cooper.    ","S3, Ep5"
Seven Twenty Three,8.4,            27 Sep. 2009    ,"As Don secures an account with Conrad Hilton, Sterling and Cooper try to strong-arm Don into signing a contract. Meanwhile, Betty meets with her acquaintance from the governor's office, and Duck tries to get Peggy to leave Sterling Cooper.    ","S3, Ep7"
Wee Small Hours,8.2,            11 Oct. 2009    ,"Betty tries to meet with Henry Francis again, while Don steps up his pursuit of his daughter's former teacher. At the office, Don disappoints Conrad Hilton and is forced by a client to fire Salvatore over an unwelcome advance.    ","S3, Ep9"
The Gypsy and the Hobo,9.2,            25 Oct. 2009    ,"An old flame and potential client reenters Roger Sterling's life, Joan's husband searches for a new job, and Don finally comes clean to Betty about his true identity.    ","S3, Ep11"
Shut the Door. Have a Seat,9.7,            8 Nov. 2009    ,"With another sale on the horizon, Sterling, Cooper, and Draper convince Lane Pryce to fire them and then join them as they start up a new advertising firm. At home, Betty follows through with her plans to divorce Don.    ","S3, Ep13"
Love Among the Ruins,7.8,            23 Aug. 2009    ,"Don is brought in to save the day for a P.R. campaign involving the building of the new Madison Square Garden, only to have the rug pulled out from under him. At home, Betty argues with her brother over how to care for their sick father.    ","S3, Ep2"
The Arrangements,8.0,            6 Sep. 2009    ,"Don has reservations about a misguided potential client who wants to sell jai alai as the ""new national pastime."" Meanwhile, Sal produces the ""Patio"" television commercial, Peggy searches for a roommate, and Betty's father passes away.    ","S3, Ep4"
Guy Walks Into an Advertising Agency,9.1,            20 Sep. 2009    ,"The bosses come in from London to reorganize Sterling Cooper, but a key player's career is sidetracked by a freak accident. Meanwhile, as Joan prepares to leave her job, her husband gives her some bad news.    ","S3, Ep6"
Souvenir,8.0,            4 Oct. 2009    ,"Don and Betty renew their love affair while on a business trip to Rome, while Peter has a bout of infidelity with an au pair in his building while his wife is away.    ","S3, Ep8"
The Color Blue,8.3,            18 Oct. 2009    ,"As Sterling Cooper prepares for its 40th anniversary party, the bosses in London drop a bombshell to Lane. Miss Farrell's troubled brother pays a visit to her and Don, and Betty stumbles onto her husband's secrets.    ","S3, Ep10"
The Grown-Ups,8.9,            1 Nov. 2009    ,"On the weekend of the John F. Kennedy assassination, Pete finds out that he lost the promotion to Cosgrove, Roger Sterling's daughter's wedding goes off as planned, and Betty musters up the courage to respond to Don's confessions.    ","S3, Ep12"
Public Relations,8.5,            25 Jul. 2010    ,"The new firm is struggling for business, so Peter and Peggy resort to a cheap publicity stunt to lure a client. Meanwhile, Don's personal problems and an unflattering newspaper interview puts his and the firm's image in jeopardy.    ","S4, Ep1"
The Good News,8.6,            8 Aug. 2010    ,"Don flies to Los Angeles to visit Anna before his New Year's vacation to Acapulco, but her bad news influences him to cancel his vacation and return to New York, where he discovers that Lane has problems of his own.    ","S4, Ep3"
The Chrysanthemum and the Sword,8.6,            22 Aug. 2010    ,"Don is forced to compete with a cocky upstart rival for a potential account with Honda motorcycles, but Roger's prejudice causes unexpected problems. Meanwhile Betty considers a psychiatrist for Sally because of her behavior.    ","S4, Ep5"
The Suitcase,9.7,            5 Sep. 2010    ,"Don deliberately delays returning an important call from California, because he knows it's bad news about Anna. Instead, he keeps himself occupied by forcing Peggy to miss her birthday dinner to pull an all-nighter with him for a client.    ","S4, Ep7"
The Beautiful Girls,8.8,            19 Sep. 2010    ,"Sally makes an unwelcome surprise visit to the office to see Don, Peggy tries to stop an acquaintance from publishing an article that could get her in hot water, and Roger Sterling tries to reconnect with Joan.    ","S4, Ep9"
Chinese Wall,8.3,            3 Oct. 2010    ,"The partners try to keep their cool after they discover that Roger has lost their biggest account, Peter's wife goes into labor, and Don tries to convince Faye to compromise her ethics to drum up new business.    ","S4, Ep11"
Tomorrowland,9.0,            17 Oct. 2010    ,"Don takes the kids to California and comes back with a surprise announcement. Meanwhile, Betty fires the kids' nanny before they move out of the old house over one questionable incident, and Peggy gets a shot at a new account.    ","S4, Ep13"
Christmas Comes But Once a Year,8.2,            1 Aug. 2010    ,"Freddy returns with a valuable new client, the firm reluctantly throws a Christmas party for its most important client, and Don prepares for his first Christmas away from his children.    ","S4, Ep2"
The Rejected,8.2,            15 Aug. 2010    ,"Peter finds out that he will become a father, and has to break some bad business news to his father-in-law. Meanwhile an office focus group study for a client has some unintended personal consequences for Don.    ","S4, Ep4"
Waldorf Stories,8.6,            29 Aug. 2010    ,"Don has a wild lost weekend after winning a CLIO award, while Peggy is forced to work all weekend in a hotel room with an ""uninspired"" co-worker. Meanwhile, Peter is livid after he learns that the other partners hired Ken Cosgrove.    ","S4, Ep6"
The Summer Man,8.6,            12 Sep. 2010    ,"While Don's thoughts turn inward while he deals with Anna's death, Peggy is placed in a difficult situation when an obnoxious employee in the creative department is disrespectful to Joan.    ","S4, Ep8"
Hands and Knees,8.7,            26 Sep. 2010    ,"Don becomes frightened that his lie will be exposed when government agents question Betty about him, Lane has shocking news for his father when he comes to bring him home, and Joan considers having an abortion.    ","S4, Ep10"
Blowing Smoke,8.8,            10 Oct. 2010    ,"Don makes a bold, desperate move to save Sterling Cooper Draper Pryce, but the other partners are furious with his actions. Meanwhile, Sally's psychiatrist suggests that she is improving, but Betty is skeptical.    ","S4, Ep12"
"A Little Kiss, Part 1",8.5,            25 Mar. 2012    ,"Megan throws Don a surprise birthday party, the war between Pete Campbell and Roger Sterling intensifies, and new mother Joan begins to wonder if she still has a job when she's ready to come back.    ","S5, Ep1"
Tea Leaves,7.8,            1 Apr. 2012    ,"Betty discovers that she has a tumor, Peggy interviews an obnoxious young copywriter for a job, the firm tries to get the Mohawk Airlines account back, and Don and Harry try to court The Rolling Stones to record a commercial.    ","S5, Ep3"
Signal 30,9.0,            15 Apr. 2012    ,"While Lane needs some help closing with a potential new client, Peter begins to crack under the pressure of both his home life and work life.    ","S5, Ep5"
At the Codfish Ball,8.7,            29 Apr. 2012    ,"Don gets a visit from the in-laws and his children just as he's about to receive a prestigious award and tries to save the Heinz account. Meanwhile, Peggy and her boyfriend take the next step in their relationship.    ","S5, Ep7"
Dark Shadows,8.0,            13 May 2012    ,"A depressed Betty tries to make things uncomfortable for Don and Megan, Roger tries to take out some secret weapons for a meeting with a prospective Jewish client, and Don makes a snap judgment that angers the creative department.    ","S5, Ep9"
The Other Woman,9.4,            27 May 2012    ,"Peter asks Joan to make an unspeakable sacrifice to help secure the Jaguar account, Peggy prepares to make a drastic move in response to Don's treatment, and Megan's acting career begins to create tension with her and Don.    ","S5, Ep11"
The Phantom,8.6,            10 Jun. 2012    ,"As the partners consider expanding the office space, Don begins seeing ghosts and gets a request to advance Megan's acting career. Meanwhile, Peter's affair comes to a disappointing end, and Megan's mom briefly reunites with Roger.    ","S5, Ep13"
"A Little Kiss, Part 2",8.5,            25 Mar. 2012    ,"Megan is hurt by Don's negative response to the surprise party, Lane finds a missing wallet in a cab, Joan makes an unexpected visit to the office, and Pete makes a play for a bigger office.    ","S5, Ep2"
Mystery Date,8.6,            8 Apr. 2012    ,"Don runs into someone from his past. Joan makes a decision, and Roger gives Peggy extra work.    ","S5, Ep4"
Far Away Places,9.1,            22 Apr. 2012    ,"A peaceful hotel getaway ends in disaster for Don and Megan, an LSD trip could have a disastrous effect on Roger's marriage, and Peggy loses her cool after an unsuccessful pitch meeting.    ","S5, Ep6"
Lady Lazarus,8.2,            6 May 2012    ,"Megan convinces Don that she should give up her job at the firm so that she can pursue a career on Broadway, while Peter has a fling with an acquaintance's wife.    ","S5, Ep8"
Christmas Waltz,8.2,            20 May 2012    ,"Lane searches for a way to get rid of a sizable debt, the firm prepares to pull out all the stops when it gets a second chance to land Jaguar as a client, and Don tries to comfort Joan when she reaches her breaking point.    ","S5, Ep10"
Commissions and Fees,9.4,            3 Jun. 2012    ,"Lane's entire world comes crashing down after getting busted for forging Don's signature on a check, and Sally experiences an awkward rite of passage while spending the weekend with the Drapers.    ","S5, Ep12"
"The Doorway, Part 1",7.6,            7 Apr. 2013    ,"Don and Megan take a trip to Hawaii for the holidays, Sally's friend visits the Francis family, a comedian torpedoes Peggy's Super Bowl ad campaign, and Roger gets some bad news about his mother.    ","S6, Ep1"
Collaborators,7.8,            14 Apr. 2013    ,"While Don continues his affair with Sylvia, Pete's latest infidelity threatens his marriage. Meanwhile, Peggy's icy relationship with her new staff continues, but she also gets an unlikely tip on a potential new client.    ","S6, Ep3"
The Flood,8.2,            28 Apr. 2013    ,"Set among the events surrounding Martin Luther King's assassination, Peggy tries to get a new apartment, Ginsberg is set up on a date, and Don has a revelation during his weekend with the kids.    ","S6, Ep5"
Man with a Plan,7.9,            12 May 2013    ,"Things quickly become awkward after the two firms merge, Don asserts his dominance over Sylvia, Pete has to deal with his ailing mother, and Bob Benson helps out a sick Joan.    ","S6, Ep7"
The Better Half,8.3,            26 May 2013    ,"Peggy becomes unsatisfied with her apartment and with Abe, Don has an eventful weekend with Betty while Megan has problems on the set, Roger has time with his grandson, and Pete begins exploring his options outside the firm.    ","S6, Ep9"
