episode_name,rating,air_date,description,episode_number
Favors,8.7,            9 Jun. 2013    ,"Don is preoccupied with keeping Sylvia's son from being drafted, Peggy has a rat in her apartment, Don and Ted bury the hatchet, Pete has a problem with his mother's new nurse, and Sally makes an accidental discovery about her father.    ","S6, Ep11"
In Care Of,9.1,            23 Jun. 2013    ,"With his personal and professional life crumbling around him, Don positions himself for a change of scenery. Meanwhile, Pete's life is falling apart as well, thanks to the meddling of Bob Benson.    ","S6, Ep13"
"The Doorway, Part 2",7.7,            7 Apr. 2013    ,"Don strikes up a friendship with the surgeon in his building, Peggy tries to save her campaign, Roger makes a scene at his mother's funeral, and Betty goes to Manhattan to find Sally's friend.    ","S6, Ep2"
To Have and to Hold,8.0,            21 Apr. 2013    ,"Don works in secret on a Heinz ketchup campaign while Megan gets a love scene on the set of her soap opera. Meanwhile, Harry makes his power play while Joan has more trouble with the secretaries.    ","S6, Ep4"
For Immediate Release,8.8,            5 May 2013    ,"As the firm prepares to go public, Don and Pete's actions cause them to lose two huge clients. However, Roger uses a new connection to put them in position to gain their biggest client ever.    ","S6, Ep6"
The Crash,8.7,            19 May 2013    ,"The creative department has a wild, drug-influenced weekend as they work on the Chevy account, Don has trouble letting go of Sylvia, and Sally walks in on an unwelcome intruder.    ","S6, Ep8"
A Tale of Two Cities,8.1,            2 Jun. 2013    ,Cutler and Chaough prepare to make radical changes to the firm while Sterling and Draper are visiting a client in Los Angeles. Joan's decision to go after a new account on her own leaves Pete furious and frustrated.    ,"S6, Ep10"
The Quality of Mercy,8.5,            16 Jun. 2013    ,"Don renews his battle with Ted after seeing his relationship with Peggy, Sally interviews at a boarding school, and Pete discovers Bob Benson's background.    ","S6, Ep12"
